episode_title,id,category,title,series,episode_name,description,description2,tags,image,directors_actors,tags2,publication_date,rating,duration_sec,season,episode
Flying Swords of Dragon Gate,64,Movies,Flying Swords of Dragon Gate,,Flying Swords of Dragon Gate,"A courtesan and a swordsman take refuge in the infamous Dragon Inn, as an explosive mix of warriors, fugitives and assassins converge for a deadly showdown. Starring international action legend, Jet Li. (2011)","A courtesan and a swordsman take refuge in the infamous Dragon Inn, as an explosive mix of warriors, fugitives and assassins converge for a deadly showdown. Starring international action legend, Jet Li.","['ABC TV', 'ABC TV Plus', 'DRAMA', 'MOVIES']",https://cdn.iview.abc.net.au/thumbs/i/zw/ZW2843A001S00_60b0938531359_1920.jpg,"[""['Director Hark Tsui']""]","['abc1', 'abc2', 'action', 'drama', 'adventure', 'film', 'period-drama', 'war', 'martial-arts', 'china', 'hong-kong', 'violent', 'edge-of-your-seat', 'fast-paced', 'critically-acclaimed', 'visual-effects', 'movie', 'a:young-adult', 'a:young-sink-dink', 'ns:be-entertained', 'cald', 'diversity']",2021-06-01 07:00:00,M,7007.0,,
Play School: The Very Silly Special,194,Kids,Play School: The Very Silly Special,,Play School: The Very Silly Special,"Join Michelle, Leah, Matt, Alex and Emma, plus a live 4-piece band as they bring us your favourite Play School songs and the silliest shenanigans in this celebration of silliness and laughter.","Join Michelle, Leah, Matt, Alex and Emma, plus a live 4-piece band as they bring us your favourite Play School songs and the silliest shenanigans in this celebration of silliness and laughter.",['ABC Kids'],https://cdn.iview.abc.net.au/thumbs/i/ck/CK2049H001S00_60e78be829ffb_3600.jpg,['[]'],"['abc4kids', 'abc90', 'abc', '90']",2021-07-18 09:06:06,G,2644.0,,
Bronwyn Oliver: The Shadows Within,243,Documentary,Bronwyn Oliver: The Shadows Within,,Bronwyn Oliver: The Shadows Within,"This intimate documentary follows the journey of Bronwyn Oliver, a working-class girl from the country who became one of Australia's most influential contemporary sculptors.","This intimate documentary follows the journey of Bronwyn Oliver, a working-class girl from the country who became one of Australia's most influential contemporary sculptors.","['ABC TV Plus', 'ABC ARTS', 'ARTS & CULTURE', 'DOCUMENTARY']",https://cdn.iview.abc.net.au/thumbs/i/ac/AC2014H001S00_6152912688858.jpg,['[]'],"['abc2', 'arts', 'abcarts', 'docs', 'factual', 'new-south-wales', 'inspirational', 'biography', 'behind-the-scenes', 'artists', 'sculpture', 'compelling', 'revealing', 'informative', 'gender', 'know-my-name', 'australia']",2021-10-13 21:03:54,PG,3567.0,,
Step Into Paradise,256,Documentary,Step Into Paradise,,Step Into Paradise,"The extraordinary story of iconic fashion designers Jenny Kee and Linda Jackson, whose pioneering style created a bold and unashamedly Australian fashion identity. (2020)","The extraordinary story of iconic fashion designers Jenny Kee and Linda Jackson, whose pioneering style created a bold and unashamedly Australian fashion identity.","['ABC TV', 'ABC ARTS', 'DOCUMENTARY', 'ARTS & CULTURE']",https://cdn.iview.abc.net.au/thumbs/i/ac/AC1906H001S00_6152912635c40.jpg,"[""['Cast Jenny Kee'"", ""'Linda Jackson']""]","['abc1', 'docs', 'factual', 'abcarts', 'arts', 'culture', 'fashion', 'design', 'biography', 'compelling', 'revealing', 'inspirational', 'informative', 'quirky', 'gender', 'diversity', 'know-my-name', 'australia']",2021-10-12 21:55:02,M,5127.0,,
Uncle Vanya,283,Drama,Uncle Vanya,,Uncle Vanya,"An adaptation of Anton Chekhov's masterpiece - a portrayal of life at the turn of the 20th century. Full of tumultuous frustration, dark humour and hidden passions, a conflicted family is forced to confront their despair.","An adaptation of Anton Chekhov's masterpiece - a portrayal of life at the turn of the 20th century. Full of tumultuous frustration, dark humour and hidden passions, a conflicted family is forced to confront their despair.","['ABC TV Plus', 'DRAMA']",https://cdn.iview.abc.net.au/thumbs/i/zw/ZW2731A001S00_61e63b08d99c7.jpg,"[""['Cast Toby Jones'"", ""'Rosalind Eleazar'"", ""'Aimee Lou Wood'"", ""'Roger Allam']""]","['abc2', 'drama', 'art', 'theatre', 'period-drama', 'melodrama', 'performance', 'family-relationship', 'family-dysfunction', '1800s', 'somber', 'dark', 'emotional', 'compelling', 'cald', 'critically-acclaimed', 'adaptation', 'uk']",2022-02-02 20:32:15,M,8912.0,,
Ties That Bind,320,Comedy,Ties That Bind,,Ties That Bind,"17 year-old Thomas has to front his domineering mother Marlene. Forced outside as punishment, sounds from neighbours echo a connection to his past and present home triggering Thomas to make a life changing decision.","17 year-old Thomas has to front his domineering mother Marlene. Forced outside as punishment, sounds from neighbours echo a connection to his past and present home triggering Thomas to make a life changing decision.","['ABC TV', 'ARTS & CULTURE', 'DRAMA', 'REGIONAL AUSTRALIA', 'INDIGENOUS']",https://cdn.iview.abc.net.au/thumbs/i/ip/IP1801V001S00_5f98eb7d6b303_1280.jpg,"[""['Director Michael Hudson']""]","['abc1', 'arts', 'australia', 'drama', 'regional', 'indigenous', 'revealing', 'people', 'culture', 'short']",2020-11-08 07:00:00,PG,720.0,,
