id,title,category,description,description2,directors_actors,publication_date,rating,duration_sec,tags,tags2,image
10229,Hoot Hoot Go!,Kids,"Let's work together! Let's solve the problem! Hoot, Hootabelle and Hootly are best friends who live together in the Land of Giggle and Hoot. Whenever someone needs help, these three owl pals come together to solve the problem.","[""Hoot and Hootabelle want to go cloud bouncing with Hootly, but she doesn't know how to do it because she's never been cloud bouncing before! How can they all go cloud bouncing together if Hootly can't join in?"", 'Pirate Hootbeard is upset when he discovers his favourite Star Cloud photo from his Piratey Book of Clouds is gone! How will the Owl Pals help Pirate Hootbeard find another Star Cloud and take a new photo?', ""The Owl Pals go to Button Island to visit Pirate Hootbeard, but he isn't feeling like his usual piratey self because he's lost his mighty Yarr! How can the Owl Pals help Pirate Hootbeard get his mighty Yarr back?"", ""It's Happy Hoot Day - the day Hoot gets to do his most favourite things! He's so excited that he forgets to share his favourite things with his Owl Pals. How can Hoot have a Happy Hoot Day if he's not sharing?"", ""The Owl Pals are playing dress-ups when they realise it's time for the Night Watch. They prepare to fly off into the Nighty-Night sky, but Hoot isn't ready! How can the Owl Pals go on the Night Watch if Hoot isn't ready?"", ""When Giggle Fangs' Fangifier breaks, it makes the Batty Lair too bright and loud. The Owl Pals each try fixing the Fangifier, but nothing works! How can they fix it and turn everything back to normal?"", 'Brave and adventurous Hootaluna gets unexpectedly homesick when she has her first sleepover at the Button Tree with the Owl Pals. How can they have the best sleepover ever if Hootaluna wants to go home to the moon?', ""The Owl Pals offer to look after Giggle Bot while Hootaluna goes on a space adventure. But Giggle Bot runs out of energy and can't moon bounce anymore. How can they go moon bouncing if Giggle Bot is too tired?"", ""Hoot, Hootabelle and Hootly are on the Night Watch when they discover Pirate Mini-Hootbeard is wide awake and can't get to sleep! How can the Owl Pals help Pirate Mini-Hootbeard fall asleep?"", ""The Owl Pals throw a surprise party for Giggle Fangs, but it's way too colourful, bright and loud for him - he likes things dark and quiet! How can the Owl Pals give Giggle Fangs a party he likes?"", ""Hootaluna wants to show the Owl Pals how to moon bounce! They don't call her 'Moon Bouncer Extraordinaire' for nothing! The Owl Pals try, but can't get it right. How can they moon bounce together if the Owl Pals can't do it?"", 'The Owl Pals are on the Night Watch when the stars start disappearing from the sky! Giggle Fangs has made all the stars disappear so he can have a nice bat nap. How can they finish the Night Watch if there are no stars?', ""The Owl Pals visit the Moon so Giggle Bot can show them his new Moon Bot dance! They're super-excited, but then the moon music player breaks! How can Giggle Bot do his new Moon Bot dance if the moon music player is broken?"", ""The Owl Pals invite Hootaluna to sing in their Owl Choir - they don't call her 'Hootaluna - Singer Extraordinaire' for nothing! But Hootaluna gets stage fright! How can the Owl Choir perform if Hootaluna can't sing?"", 'The Owl Pals are off to search for the Perfect Piratey Picnic Spot with Pirate Hootbeard, but they lose their special map showing the perfect picnic spot! How can they have a picnic without the perfect piratey picnic spot?', ""Hootaluna gives the Owl Pals a Moon Dancing lesson, but her Moon Boots malfunction... and the lesson is ruined. How can Hootaluna be the best moon dancing teacher in the Giggle Galaxy if her Moon Boots don't work?"", ""Hoot, Hootabelle and Hootly invite Giggle Fangs and his toy Giggle Bug to a tea party at the Button Tree. But when he arrives, they can't find Giggle Bug anywhere! How can they have a tea party without Giggle Bug?"", ""It's Boo Day - everyone dresses up as bats and surprises each other with a 'Boo!'. The Owl Pals go to the Batty Lair to celebrate with Giggle Fangs, but his boo doesn't work! How can they help him get his boo back?"", ""Hoot, Hootabelle and Hootly are getting ready to go to Pirate Mini-Hootbeard's birthday party, when Hoot realises his pirate outfit has shrunk! How can he go to a piratey party without a piratey outfit?"", ""The Owl Pals are putting on a special concert for their toys - but they can't agree on which song to sing. How are they going to put on the best concert ever for the toys without the right song to sing?"", ""When Hoot, Hootabelle and Hootly can't find Pirate Mini-Hootbeard during a game of Hoot and Seek, they make the Button Tree super messy trying to find where he's hiding. How can they find Pirate Mini-Hootbeard now?"", ""The Owl Pals have each made a cubby house, but when they decide to have a tea party in one of them, they can't choose because none of them are quite right. How will they have their tea party without the perfect cubby?"", ""The Owl Pals want to go on a big treasure hunt with Pirate Hootbeard.  But Pirate Mini-Hootbeard wants to go on a little treasure hunt! How can the Owl Pals find a tiny treasure that's just the right size for a mini-pirate?"", ""The Owl Pals want to go rainbow sliding on the colourful Button Rainbow, only to find Giggle Fangs has turned it grey because it's his favourite colour. How can they make the Button Rainbow all the colours everybody loves?"", ""Hootaluna offers to help the Owl Pals find their missing Hootball, but she's mistaken it for a Moon Rock and added it to her Moon Rock Collection! How will Hootaluna find the Hootball if she doesn't know what it is?"", ""The Owl Pals want to play Hoot and Seek with Giggle Fangs, but his Supersonic Bat Hearing makes it hard for him to play because he can hear them no matter where they hide! How can they play if Giggle Fangs can't join in?""]",['[]'],2022-03-27 05:27:14,G,"[307.0, 312.0, 305.0, 312.0, 312.0, 311.0, 312.0, 312.0, 312.0, 291.0, 297.0, 309.0, 305.0, 310.0, 310.0, 312.0, 312.0, 312.0, 296.0, 307.0, 293.0, 295.0, 311.0, 311.0, 312.0, 311.0]",['ABC Kids'],"['hoot-hoot-go', '4animals', '4halloween', 'abc4kids', '4space-day']",https://cdn.iview.abc.net.au/thumbs/i/ch/CH1432H005S00573557eb1b0883.36481635_1280.jpg
10343,Muster Dogs,Family,Five graziers from across Australia are given five Kelpie puppies from the same litter and set with the challenge of transforming these uniquely Australian dogs into champion muster dogs.,"['The puppies are now one year old and have all gathered with their owners to complete their final 12-month assessment. One pup shines brighter than the pack and is rightfully crowned Champion Muster Dog! (Final)', 'The puppies are now six months old and are very busy developing their stalking livestock techniques and learning manners and basic calls.', ""It's spills and thrills as the puppies and trainers stumble and at times leap through the milestone challenges. Frank and CJ are going well but Joni, Aticia and Rob are off to a bumpy start."", 'Five graziers from across Australia are given five Kelpie puppies from the same litter and set with the challenge of transforming these uniquely Australian dogs into champion muster dogs.', 'Spanning the red earth of the Top End to the green pastures of regional Victoria, this new four-part documentary series follows five Kelpie puppies from the same litter on their journey to become muster dogs.']",['[]'],2022-01-23 19:42:00,G,"[3420.0, 3390.0, 3360.0, 30.0, 3360.0]","['ABC TV', 'DOCUMENTARY', 'REGIONAL AUSTRALIA', 'FAMILY']","['endearing', 'real-life', 'diversity', 'regional', 'wildlife', 'factual', 'docuseries', 'iview', 'family-viewing', 'trailers', 'charming', 'farm', 'animals', 'farming', 'binge-worthy', 'feel-good', 'australia', 'inspirational', 'docs', 'uplifting', 'small-town', 'lighthearted', 'abc1', 'promo', 'outback']",https://cdn.iview.abc.net.au/thumbs/i/rf/RF2003H004S00_61e77f8859c0e_1920.jpg
10376,Operation Ouch! Hospital Takeover,Family,Chris and Xand join forces once again as Operation Ouch takes over Alder Hey to reveal the incredible things that go on behind the scenes and on the wards of one of Europe's largest children's hospitals.,"[""The Doctors reveal why your body can't survive without oxygen for more than three minutes, and they find out what it's like to be 999 Call Handlers in Operation Takeover."", ""The Doctors reveal how amazing your saliva is, and they find out why the hospital's maintenance teamwork with birds of prey. Dr Chris heads to the Emergency Department to find how the doctors know who to treat first."", ""The Doctors reveal the amazing army of germ-fighters that make up your immune system, and they find out just how difficult it is to clean a baby's incubator in Operation Takeover."", 'The Doctors reveal the special cells in your eyes which help you to see out of the corner of your eye and they find out what it takes to be a hospital entertainer.', 'The Doctors reveal how important cartilage is to your body with the help of a suit of armour, and they find out what it takes to be a hospital porter. Dr Chris meets Nala the dog to see how she helps patients in hospital.', 'The Doctors reveal how your eardrum works to enable you to hear and they find out how tough it is to be Hospital Radio Hosts. Dr Chris discovers what it takes for anesthetists to keep you safe and pain-free during operations.', 'In the last episode of the series, the Doctors reveal the amazing strength of your jaw, and they see if they can take the heat when they try their hands at being hospital ward chefs in Operation Takeover.', ""The Doctors reveal the amazing job your pancreas does to keep your blood-sugar levels in check, and they find out what it's like to be the hospital postman in Operation Takeover."", 'The Doctors find out why we burp and even manage a world first when they film Dr Xand burping from the inside. They also get behind the wheel to discover what it takes to be a good ambulance driver.', ""The Doctors reveal what makes you flexible as they test the incredible strength of a tendon to the max, and they find out what it's like to be Air Ambulance pilots in Operation Takeover.""]","[""'Chris Van Tulleken']"", ""['Cast Xand Van Tulleken'""]",2020-10-18 06:01:00,G,"[1693.0, 1695.0, 1689.0, 1695.0, 1695.0, 1695.0, 1684.0, 1693.0, 1695.0, 1673.0]","['ABC ME', 'FAMILY']","['family-viewing-abcme', 'abc3-faves', 'family-viewing', 'me-officially-crazy', '3tween', 'abc3', 'me-new-releases', '3family', '3real']",https://cdn.iview.abc.net.au/thumbs/i/zw/ZW0923A004S00_58649d024227e_1280.jpg
10483,The Adventures Of Paddington,Kids,"The Adventures of Paddington is a new version of a familiar bear. A heart-warming show about being curious, being good to others, and being part of a loving family.","[""The children want to camp out for the night in the treehouse. Mr Brown is worried he won't get sleep as the kids will be scared. Paddington wants to prove him wrong, but a lightning storm means they have to come in doors."", 'Mrs Bird is a champion hide and seeker, but where is she? Paddington, Jonathan and Judy must try to find her.', 'Mr Gruber gives Paddington a box of magic tricks, but Paddington cannot master the tricks until he learns to practice, practice, practice.', ""It's Pancake Day. But in the Brown's house, it's cancelled as Mrs Bird has hurt her arms snowboarding and only she knows the secret recipe. Paddington rescues the day with his own attempts at making a flat cake."", 'Jonathan has lost his balloon. Paddington tries to get him a new one but accidentally ends up flying all over London. How will he get down? Pigeonton get help!', ""Judy has forgotten to do her homework and can't think of what to do for her geography project. Paddington tries to help and ends up being the subject once he talks about his home."", 'Mr Curry is invited by Paddington to stay with the Browns whilst his flooded house is being repaired. He thinks the Browns are too disorganised, so he starts to change the way things are done in the house. When will he leave?', ""Paddington does not have a hobby the Browns all seem to be good at something, but's he's not. Mrs Brown finds out what Paddington is good at in the end."", ""There's a monster in Paddington's room, so Mrs Bird takes Paddington on a monster hunt."", ""Jonathan and Paddington dig up some broken pottery. It turns out it's not Roman, but a statue made by Mrs Brown. But who broke it? Was it Judy's guilty secret? Or was it Mr Brown?"", ""Paddington wins a raffle and first prize is a meal for two at Sofia's cafe, but who is Paddington's best friend? Is it Jonathan or Judy or Mateo or Mr Gruber? It's time to find out... how will he choose a best friend?"", 'Paddington accidentally takes a banana from the cafe without paying for it. He must return it before Sophia notices and calls PC Wells, but Mrs Bird turns it into a cake! What will he do?', ""Paddington is accidentally delivered inside a wardrobe to Mr Curry's house. How will he get out before being discovered?"", 'The family all have chores except Paddington. So as not to be excluded, Mr Brown creates a list for him to follow, but Paddington picks up the wrong list.', 'A pigeon comes down the chimney at 32 Windsor Gardens. Paddington nurses the poor bird back to health and discovers a new friend in Pigeonton, but can he let him go?', ""Mateo and Judy form a secret club in the treehouse but won't let Jonathan and Paddington join without a password. Can Paddington discover the secret code word?"", 'Mr Gruber gives Paddington a film camera to record his adventures in Windsor Gardens to send to Aunt Lucy in the retired home for bears in Lima. What will he film?', ""Paddington gets his arm stuck in a post box after accidentally using Mr Gruber's rare Penny Black on his letter to Aunt Lucy."", 'Paddington is given a metal detector by Mr Gruber. Beep beep beep! What has Paddington found now? Is it the lost pirate treasure or just another rusty bottle cap?', ""It's snowing in Windsor Gardens. Paddington has lost a special wooly hat given to him by Aunt Lucy and must find it. Will the brave polar explorers Jonathan, Judy and Paddington return?"", ""Mrs Brown can't find inspiration for her next art work so Paddington decides to help find her mojo!"", 'Judy does not like violin lessons so she hides from Ms Potts. Paddington takes up the challenge. Watch out, ears!', ""Pigeonton has nested in a lamp post outside Mr Gruber's shop, but the council have condemned it! Where will Pigeonton live now? Paddington decides to find him a new home!"", ""Jonathan teaches Paddington football, but Paddington kicks the ball into Mr Curry's garden. Can we have our ball back? No! They decide to get it back by climbing over the fence. Mind my gnomes!"", ""Paddington is playing a game with Jonathan and Judy in the park. Mateo thinks it looks fun and wants to play too, but he can't because he is looking after the cafe. Paddington says he will watch the cafe so Mateo can play.""]",['[]'],2022-03-26 17:15:16,G,"[660.0, 660.0, 660.0, 660.0, 660.0, 660.0, 660.0, 660.0, 660.0, 660.0, 660.0, 660.0, 660.0, 660.0, 660.0, 660.0, 660.0, 660.0, 660.0, 660.0, 660.0, 660.0, 660.0, 660.0, 660.0]",['ABC Kids'],"['abcme-shoulder', 'abc4kids']",https://cdn.iview.abc.net.au/thumbs/i/zw/ZW2511A009S00_5ff3e6d725fdc.jpg
